{
  "$schema": "https://json-schema.org/draft/2020-12/schema",
  "title": "Glass–Silicon Relationship Graph v0.1",
  "description": "Typed evidence relationships and split assignments for synthetic, offline benchmark audits. Schema validity does not certify source truth or rights.",
  "type": "object",
  "additionalProperties": false,
  "required": [
    "schema_version",
    "benchmark_id",
    "evidence_class",
    "claim_ceiling",
    "relation_profile",
    "leakage_edge_types",
    "allowed_splits",
    "nodes",
    "edges",
    "assignments"
  ],
  "properties": {
    "schema_version": {
      "const": 1
    },
    "benchmark_id": {
      "type": "string",
      "pattern": "^[a-z0-9][a-z0-9_-]*$"
    },
    "evidence_class": {
      "type": "string",
      "minLength": 1
    },
    "claim_ceiling": {
      "type": "string",
      "minLength": 1
    },
    "relation_profile": {
      "const": "provenance_identity_v0",
      "description": "Only registered v0.1 relationship profile; new profiles require a reviewed schema/contract revision."
    },
    "leakage_edge_types": {
      "const": [
        "derived_from",
        "replicate_of",
        "same_record"
      ],
      "description": "Frozen leakage edge set for provenance_identity_v0; callers cannot weaken it per graph."
    },
    "allowed_splits": {
      "const": [
        "train",
        "validation",
        "test"
      ]
    },
    "nodes": {
      "type": "array",
      "minItems": 1,
      "maxItems": 10000,
      "items": {
        "type": "object",
        "additionalProperties": false,
        "required": [
          "node_id",
          "node_kind",
          "split_required"
        ],
        "properties": {
          "node_id": {
            "type": "string",
            "pattern": "^[a-z0-9][a-z0-9_-]*$"
          },
          "node_kind": {
            "type": "string",
            "pattern": "^[a-z0-9][a-z0-9_-]*$"
          },
          "split_required": {
            "type": "boolean",
            "description": "True when this node represents a dataset item that must be assigned to exactly one evaluation split. False for lineage-only artifacts such as derived tables."
          }
        }
      }
    },
    "edges": {
      "type": "array",
      "maxItems": 50000,
      "items": {
        "type": "object",
        "additionalProperties": false,
        "required": [
          "source_id",
          "target_id",
          "edge_type",
          "state",
          "evidence_refs"
        ],
        "properties": {
          "source_id": {
            "type": "string",
            "pattern": "^[a-z0-9][a-z0-9_-]*$"
          },
          "target_id": {
            "type": "string",
            "pattern": "^[a-z0-9][a-z0-9_-]*$"
          },
          "edge_type": {
            "type": "string",
            "pattern": "^[a-z0-9][a-z0-9_-]*$"
          },
          "state": {
            "enum": [
              "verified",
              "candidate",
              "contradicted",
              "unknown"
            ]
          },
          "evidence_refs": {
            "type": "array",
            "items": {
              "type": "string",
              "minLength": 1
            }
          }
        },
        "allOf": [
          {
            "if": {
              "properties": {
                "state": {
                  "const": "verified"
                }
              },
              "required": [
                "state"
              ]
            },
            "then": {
              "properties": {
                "evidence_refs": {
                  "minItems": 1
                }
              }
            }
          }
        ]
      }
    },
    "assignments": {
      "type": "array",
      "minItems": 1,
      "items": {
        "type": "object",
        "additionalProperties": false,
        "required": [
          "node_id",
          "split"
        ],
        "properties": {
          "node_id": {
            "type": "string",
            "pattern": "^[a-z0-9][a-z0-9_-]*$"
          },
          "split": {
            "enum": [
              "train",
              "validation",
              "test"
            ]
          }
        }
      }
    }
  }
}
