{
  "schema_version": 1,
  "benchmark_id": "relationship-graph-valid-synthetic-v0-1",
  "evidence_class": "synthetic",
  "claim_ceiling": "Synthetic relationship-graph contract only; no real data, rights, model performance, or physical effect is certified.",
  "relation_profile": "provenance_identity_v0",
  "leakage_edge_types": [
    "derived_from",
    "replicate_of",
    "same_record"
  ],
  "allowed_splits": [
    "train",
    "validation",
    "test"
  ],
  "nodes": [
    {
      "node_id": "sample-a",
      "node_kind": "sample",
      "split_required": true
    },
    {
      "node_id": "feature-a",
      "node_kind": "derived_feature",
      "split_required": false
    },
    {
      "node_id": "sample-b",
      "node_kind": "sample",
      "split_required": true
    },
    {
      "node_id": "feature-b",
      "node_kind": "derived_feature",
      "split_required": false
    },
    {
      "node_id": "sample-c",
      "node_kind": "sample",
      "split_required": true
    },
    {
      "node_id": "feature-c",
      "node_kind": "derived_feature",
      "split_required": false
    }
  ],
  "edges": [
    {
      "source_id": "sample-a",
      "target_id": "feature-a",
      "edge_type": "derived_from",
      "state": "verified",
      "evidence_refs": [
        "fixture:edge-a"
      ]
    },
    {
      "source_id": "sample-b",
      "target_id": "feature-b",
      "edge_type": "derived_from",
      "state": "verified",
      "evidence_refs": [
        "fixture:edge-b"
      ]
    },
    {
      "source_id": "sample-c",
      "target_id": "feature-c",
      "edge_type": "derived_from",
      "state": "verified",
      "evidence_refs": [
        "fixture:edge-c"
      ]
    }
  ],
  "assignments": [
    {
      "node_id": "sample-a",
      "split": "train"
    },
    {
      "node_id": "sample-b",
      "split": "validation"
    },
    {
      "node_id": "sample-c",
      "split": "test"
    }
  ]
}
